,Source,Document,URL,Text,Date
0,Australia AUSTRAC,FATF updates on global ML/TF risk,,"The Financial Action Task Force (FATF), the global group that sets international anti-money laundering and counter-terrorism financing (AML/CTF) standards, has published two recent updates relating to international ML/TF risk.  The reports provide an update on jurisdictions which may pose a risk to the international financial system:  High-Risk Jurisdictions subject to a Call for Action – 23 October 2020 – noting that the 21 February 2020 call for action in relation to the Democratic People’s Republic of Korea and Iran remains in effect. Jurisdictions under Increased Monitoring – 23 October 2020 – jurisdictions that have strategic deficiencies in their AML/CTF regimes and are actively working with the FATF to address them.  Reporting entities should be aware of countries that pose a higher risk of money laundering or terrorism financing and use this information to help guide ML/TF risk assessments, compliance programs and decisions about submitting suspicious matter reports to AUSTRAC.  For further information, see AUSTRAC’s guidance on high-risk countries, regions and groups. ",5 January 2021
1,Australia AUSTRAC,AUSTRAC organisational chart,,"AUSTRAC’s organisational chart shows our structure as of March 2021.  AUSTRAC organisational chart (PDF, 123KB)   ",29 March 2021
2,Australia AUSTRAC,Review your AML/CTF compliance program with our latest guides,,"Throughout 2020 we saw a number of key areas where businesses could improve their anti-money laundering and counter-terrorism financing (AML/CTF) compliance.  To help you review and strengthen your AML/CTF program, systems and controls, we’ve developed five new regulatory guides.  These guides cover key areas of AML/CTF compliance identified through our regulatory activity during 2020. Using the guides will help you continue to meet your AML/CTF compliance obligations and protect your business.  Governance: board and senior management oversight  Boards and senior management must lead a positive, organisation-wide AML/CTF compliance culture in your business. Find out why it’s crucial for senior leadership to be involved in all activities that could impact AML/CTF compliance to ensure risks are understood, mitigated and managed.  Download the Governance: board and senior management oversight regulatory guide. (PDF, 167KB)  Money laundering/terrorism financing risk assessments  Regular reviews of your ML/TF risk assessment are essential to complying with your AML/CTF obligations. This quick guide underlines the need to respond promptly to the latest advice about new and emerging risks and to review your business’ risk assessments on an ongoing basis to ensure your systems and controls remain appropriate.  Download the Money laundering/terrorism financing risk assessments regulatory guide. (PDF, 169KB)  Ongoing customer due diligence  Ongoing customer due diligence helps to protect your business and the community from serious and organised crime. Understand how your transaction monitoring program must operate to help you identify suspicious activity, and to support enhanced customer due diligence.  Download the Ongoing customer due diligence regulatory guide. (PDF, 169KB)  International Funds Transfer Instructions (IFTIs) reporting  IFTI reporting continues to be a key area of vulnerability for businesses. This quick guide highlights the importance of ensuring your IFTI reports are complete, accurate and timely, and that systems are in place to ensure reporting is not interrupted if there are changes to your systems or processes.  Download the International Funds Transfer Instructions (IFTIs) reporting regulatory guide. (PDF, 122KB)  Correspondent banking relationships  A lack of due diligence on correspondent banks can expose your business and result in breaches of your obligations. Find out more about how to manage the risks involved with correspondent banking relationship.  Download the Correspondent banking relationships regulatory guide. (PDF, 110KB) ",29 March 2021
3,Australia AUSTRAC,Ongoing customer due diligence,, ,30 March 2021
4,Australia AUSTRAC,International Funds Transfer Instructions (IFTIs) reporting,, ,30 March 2021
5,Australia AUSTRAC,Correspondent banking relationships,, ,30 March 2021
6,Australia AUSTRAC,Governance: board and senior management oversight,, ,30 March 2021
7,Australia AUSTRAC,AUSTRAC's approach to regulation,, ,7 April 2021
8,Australia AUSTRAC,Financial Action Task Force public consultations,,"The Financial Action Task Force (FATF) is inviting feedback on draft guidance about proliferation financing risk, and on digital currencies and digital currency exchange providers, known internationally as virtual assets and virtual asset service providers.  FATF is the global standard-setting body for anti-money laundering and counter terrorism-financing (AML/CTF). Guidance and recommendations issued by FATF are not legally binding in Australia, but these international standards strongly influence the development of AML/CTF legislation around the world.  You can find more details and links to each document and consultation below.  Public consultation on a risk-based approach to digital currencies and digital currency exchange providers  FATF is currently consulting on updates to draft guidance for a risk-based approach to digital currency and digital currency exchange providers, known internationally as virtual assets and virtual asset service providers.  The updated guidance focuses on six main areas which includes guidance on how the FATF Standards apply to so-called stablecoins, additional guidance on the risks and potential ways to mitigate the risks of peer-to-peer transactions and on the implementation of the ‘travel rule’.  The public consultation closes on 20 April 2021.  For more information about the consultation or to provide a written response, visit the FATF website.  Public consultation on mitigating proliferation financing risk  FATF has also been consulting on draft guidance to help the public and private sectors to identify, assess, understand and mitigate proliferation financing risk, as recommended in newly revised FATF standards.  The guidance seeks to assist the public and private sectors in conducting a risk assessment in the context of proliferation financing, and applying corresponding risk mitigation measures.  The public consultation will soon close on 9 April 2021.  For more information, visit the FATF website.  ",6 April 2021
9,Australia AUSTRAC,Rule extended to support COVID-19 early release of superannuation initiative,,"AUSTRAC has extended the Rule for streamlined customer verification under the COVID-19 early release of superannuation initiative until 31 December 2020.  This extension supports the Government’s decision to allow the COVID-19 early release of superannuation initiative to continue until 31 December 2020.  Customer verification obligations under the Rule  In March this year, AUSTRAC introduced a Rule under the Anti-Money Laundering and Counter-Terrorism Financing Act 2006 (AML/CTF Act) to facilitate streamlined payments by superannuation funds to their members under the COVID-19 early release of superannuation initiative.  Under the Rule, where the payment under this initiative is approved by the ATO, superannuation funds do not have to conduct upfront customer verification for AML/CTF purposes.  Other obligations under the AML/CTF Act still apply, including ongoing customer due diligence and suspicious matter reporting.  Learn more about the Rule and your obligations  If you need assistance  If you are an individual affected by COVID-19 enquiring about early access to your superannuation, please contact the ATO directly. ­  If you are an AUSTRAC reporting entity and have questions about your customer due diligence obligations, please contact us using the online form. ",7 April 2021
10,Australia AUSTRAC,Money laundering/terrorism financing risk assessments,, ,30 March 2021
11,Australia AUSTRAC,Consultation now open on Rules for AML/CTF reforms,,"Reforms have been made to strengthen Australia’s anti-money laundering and counter-terrorism financing laws.  The reforms, known as Phase 1.5, will increase the resilience of our financial system against criminal threats, while making it easier for businesses to understand and comply with their obligations.  A summary of the changes for AUSTRAC reporting entities is included below.  Implementing the changes  There will be a transition period for businesses to implement the reforms, and we will provide guidance during this time to support you.  Draft Rules for review and consultation  The draft Rules to support the implementation of the Phase 1.5 reforms are now available for review and consultation.  Read the draft Rules and submit your feedback  Summary of changes for reporting entities Customer due diligence  These reforms make it clear that customers must be identified before providing a designated service, except for very limited circumstances. They also expand the circumstances where you can rely on customer identification by another reporting entity.  Tipping off  There will be expanded exceptions to tipping-off provisions that allow information from suspicious matter reports (SMRs) to be shared with an external auditor, or offshore members of the same corporate or designated business group that are regulated by laws that give effect to some or all of the FATF recommendations .  Correspondent banking  These changes affect financial institutions. The reforms include clearer prohibitions against entering into a relationship with a bank that allows its accounts to be used by a shell bank, in addition to clearer and strengthened due diligence and risk assessment requirements during a correspondent banking relationship.  Additional measures  In addition to these changes, the Phase 1.5 reforms support cooperation and collaboration to detect, deter and disrupt money laundering, terrorism financing, and other serious crimes, and increase the AUSTRAC CEO’s ability to provide access to AUSTRAC information to law enforcement partners. ",27 January 2021
12,Australia AUSTRAC,Typologies and case studies report 2012,, ,7 April 2021
13,Australia AUSTRAC,Copyright,,"© AUSTRAC for the Commonwealth of Australia  Copyright in all material produced by AUSTRAC is owned by the Commonwealth of Australia. This material is provided under a Creative Commons licence, except for the following:  the AUSTRAC logo the Commonwealth Coat of Arms content provided by third parties. Attribution  If you use material from this website you must attribute copyright to AUSTRAC. You should do this by using ‘© AUSTRAC for the Commonwealth of Australia 2019’.  As long as you attribute copyright to AUSTRAC, you are free to copy, adapt, modify, transmit and distribute AUSTRAC-produced material as you wish. Further, if you use AUSTRAC-produced material, you must ensure that you do not use it in any way that suggests AUSTRAC or the Australian Government endorses you or any of your services or products.  Using the Commonwealth Coat of Arms  Guidelines for use of the Coat of Arms are published by the Department of Prime Minister and Cabinet.  Third party copyright  Where a third party holds copyright in material on this website you may need their permission to use it.  AUSTRAC has made all reasonable efforts to:  clearly label material where a third party owns copyright get consent from the copyright owner to use their material on this website. ",7 April 2021
14,Australia AUSTRAC,Coronavirus (COVID-19) – Working with our reporting entities,,"       Coronavirus update  The global pandemic, COVID-19, is impacting all Australians and Australian businesses. AUSTRAC acknowledges that this is an unprecedented and uncertain time for you and your business. As Australia’s Anti-Money Laundering and Counter-Terrorism Financing regulator and Financial Intelligence Unit, AUSTRAC regulates more than 15,000 individuals, businesses and organisations. You are the front line of defence in the fight against financial crime and terrorism financing. AUSTRAC will constructively work with you as you manage your money laundering and terrorism financing risks during this disruptive period. This includes considering your circumstances when applying the Anti-Money Laundering and Counter-Terrorism Financing laws. We are working across government to ensure AUSTRAC is prepared for all scenarios including a reduced workforce. We have a business continuity plan in place which will allow us to maintain our core functions and continue our work with you, to protect Australians from serious financial crime and terrorism. If you have questions about complying with your anti-money laundering and counter-terrorism obligations or concerns about COVID-19 and the impact on your business, please email us via our contact form.   ",7 April 2021
15,Australia AUSTRAC,Customer identification and due diligence overview,,"As a reporting entity, you must identify and know your customers.  Your customer identification procedures – Know your customer (KYC) procedures – must be documented in Part B of your AML/CTF program. All AML/CTF programs must include a Part B program.  To identify, mitigate and manage money laundering and terrorism financing (ML/TF) risk, you need ongoing customer due diligence processes. This includes developing and documenting an enhanced customer due diligence program and a transaction monitoring program in Part A of your AML/CTF program.  Holders of an Australian Financial Services Licence (AFSL) who arrange for their customers to receive a designated service, and do not provide any other designated services, do not have to have a Part A program.  Customer identification and ongoing customer due diligence processes will help you identify unusual transactions and behaviour, to identify and manage high-risk customers and report suspicious matters when appropriate.  Identifying and verifying customers: Part B of your AML/CTF program  Part B of your written AML/CTF program must document in detail the procedures you use to identify your customers and verify that their information is correct. After using these ‘applicable customer identification procedures’ you must be reasonably satisfied that:  an individual customer is who they claim to be a customer who is not an individual (such as a company, association or trust) is a real entity and you know the details of its beneficial owners. Applicable customer identification procedures  Applicable customer identification procedures (ACIP) include:  collecting and verifying customer identification information through know your customer procedures identifying and verifying the beneficial owner(s) of a customer identifying whether a customer or beneficial owner of a customer is a politically exposed person (PEP) getting information on the purpose and intended nature of the business relationship.  Your ACIP must consider, among other things:  the nature, size and complexity of your business the purpose of your business relationship with your customers the type of ML/TF risk you might reasonably face customer types (including beneficial owners and politically exposed persons) customers’ sources of funds and wealth control structures of non-individual customers types of designated services provided how you deliver these services the foreign jurisdictions you deal with.  If there is a higher risk associated with a customer, you will need to collect and verify more information to ensure you are reasonably satisfied that your customers are who they claim to be and that you are effectively managing your ML/TF risk.  Your systems and controls must:  consider the ML/TF risks identified include procedures to collect and verify information relating to a customer's agent.  Your staff and, if applicable, your agents, must understand your ACIP and you must monitor and ensure compliance with these procedures.  In most cases, it is a requirement to carry out ACIP before providing a designated service, and the designated service must not be provided if a customer cannot first meet the ACIP requirements. Not carrying out your ACIP due to customers being unhappy or uncooperative puts your business and your community at greater risk and is a breach of your obligations.  Failure to correctly conduct ACIP on customers can significantly impact ongoing identification, mitigation and management of ML/TF risks and introduce risks across all aspects of AML/CTF compliance. ",12 April 2021
16,Australia AUSTRAC,Transaction monitoring,,"A transaction monitoring program helps your business to:  Identify, mitigate and manage money laundering and terrorism financing (ML/TF) risk Identify and report suspicious matters to AUSTRAC meet your ongoing customer due diligence (OCDD) and enhanced customer due diligence (ECDD) obligations.  You must document how you monitor customer transactions in Part A of your AML/CTF program. Your transaction monitoring program must be based on your risk assessment of your business or organisation and define the processes you follow to identify suspicious customer transactions, including:  unusually large transactions complex transactions unexpected patterns of transactions that don’t seem to have a legitimate purpose.  How you monitor transactions and develop your program depends on the size of your business or organisation and your level of ML/TF risk. Depending on the type, size and complexity of your business or organisation, your transaction monitoring program can be manual or automated. You should allocate appropriate resources and priority to analysing and actioning alerts raised by transaction monitoring.  Your transaction monitoring program  You must have an appropriate risk-based monitoring program in place to help your employees identify suspicious transactions and take steps to protect your business or organisation.  Your transaction monitoring program should:  define the processes you follow to identify suspicious customer transactions document appropriate risk-based systems and controls that capture all necessary sources of customer and transaction data or information set out systems and controls that trigger alerts for further review such as: size, frequency or patterns of transactions that may indicate unusual or suspicious activity, including suspected fraud or identity theft transactions that are sent to or received from a high-risk country or region payments that are sent to or received from a person or organisation on a sanctions list activities that may be inconsistent with a customer's risk profile or history increased monitoring of higher risk customers previously suspected of or investigated for potentially suspicious activity other unexpected account activity from a customer which may indicate money laundering or terrorism financing  implement processes to consistently review and manage the internal escalation and investigation of alerts prioritise alerts according to the level of risk document processes to consistently manage the reporting of potentially suspicious matters detail sufficient assurance processes to review the management of alerts continually monitor transactions at all levels, not just, for example by branch or venue level document processes with sufficient specificity to enable them to be consistently applied document and audit any automated transaction monitoring processes. How your processes work together  Your processes and information sources must work together to monitor the services you are providing to customers to identify, mitigate and manage ML/TF risks.  Transaction monitoring, reporting, ECDD, ACIP and other information all contribute to a better understanding of your customers. These processes and information sources must contribute to a single understanding of the customer and their risk profile, rather than operate or exist independently.  Transaction monitoring alerts must be considered against the customer’s history, including any information from law enforcement. You must ensure there is a central or fully accessible customer history for customer due diligence purposes.  For example, different teams in your business might hold information about a customer’s suspected connections to terrorism, transaction monitoring alerts, suspicious activity on the customer’s account and information from law enforcement about this customer.  Your systems and controls must be able to merge and combine this information in a timely manner, to provide a comprehensive view of the customer’s ML/TF risks.  Review and assurance of your transaction monitoring program  Your transaction monitoring must be applied to all designated services at all times. It must be supported by appropriate accountability and review mechanisms, to confirm that:  processes are in place to make certain no disruptions to downstream AML/CTF processes occur when any changes are made to systems all systems changes that may potentially affect AML/CTF compliance require AML/CTF sign off all necessary assurance processes are in place and AML/CTF processes are fully documented and mapped.  Transaction monitoring must be periodically audited and reviewed to ensure it is operating as intended. Audits and reviews must confirm that transaction monitoring is based on complete data, and that transaction monitoring rules remain appropriate and current. Automated transaction monitoring systems and program alerts need to incorporate any new methodologies, typologies or crime types.  Resolving any system issues must also receive adequate resourcing and priority. This should also be addressed from the time the failure or breakdown was identified to cover all past transactions.  Any problems identified must be addressed promptly. Failure to monitor transactions can have serious flow-on effects to other AML/CTF processes such as SMR reporting, conducting ECDD and the ongoing identification of ML/TF risks. ",12 April 2021
17,Australia AUSTRAC,Remittance service providers,,"A remittance service provider is an individual, business or organisation that accepts instructions from customers to transfer money or property to a recipient. Remittance service providers are also known as ‘money transfer businesses’.  Video: Guidance for remittance service providers ",15 April 2021
