,Source,Document,URL,Text,Date
82,Australia AUSTRAC,SMR case study examples,,"These case study examples demonstrate the importance of effective suspicious matter reporting in criminal investigations.  Offender structures $2.5 million over five years to evade tax  Using cash from his retail business, the offender systematically structured deposits totalling over A$2.5 million in an attempt to avoid transaction reporting requirements and evade tax. The resulting investigation was triggered by an SMR submitted by a bank. Read more  Online transactions lead to convictions for child sex offences  Financial transaction and suspicious matter reporting from four reporting entities helped to uncover numerous funds transfers to high-risk jurisdictions. A referral from AUSTRAC helped law enforcement target registered sex offenders travelling overseas to commit offences against children. Read more  Suspicious funds transfers reveal million dollar drug syndicate  An SMR submitted to AUSTRAC was key to dismantling an international drug syndicate operating in Australia. Authorities used this information to identify people and financial transactions of interest and to establish links between syndicate members. Two offenders were convicted. Read more  AUSTRAC data helped capture international cybercriminal  AUSTRAC used SMRs from reporting entities to identify an offender who had multiple Australian bank accounts under a false name and who was moving large, unexplained amounts of cash domestically and overseas. The offender was found to be an international fugitive, wanted for cybercrime and fraud-related offences in the US. He was charged and convicted. Read more  Welfare recipients found with $100,000 cash and cannabis  The SMRs passed to authorities by AUSTRAC prompted a police investigation into the unexplained wealth of a married couple, who had substantial assets inconsistent with their declared income. The investigation resulted in three arrests, disruption of illicit drug supply, and the seizure of A$100,000 in cash, and other assets. Read more ",12 May 2021
83,Australia AUSTRAC,Australia's securities and derivatives sector: money laundering and terrorism risk assessment 2017,, ,10 May 2021
84,Australia AUSTRAC,Junket tour operations in Australia risk assessment 2020,, ,10 May 2021
85,Australia AUSTRAC,Lists of enforcement actions taken,,AUSTRAC can take enforcement action against reporting entities who don’t comply with AML/CTF legislation. These enforcement actions are:  civil penalty orders enforceable undertakings infringement notices remedial directions.  AUSTRAC publishes information about its enforcement actions. We do this so we remain transparent and accountable and to provide information about our enforcement actions to all reporting entities.  You can find out more about the consequences of not complying. ,19 May 2021
86,Australia AUSTRAC,Lists of exemptions and modifications granted,,"AUSTRAC can grant an exemption to provisions of the AML/CTF Act or FTR Act to specified individuals, businesses or organisations. These exemptions can be revoked, either at the request of a reporting entity or at our discretion. We can also grant modifications to provisions of the AML/CTF Act. Modifications of obligations are not available under the FTR Act. We are legally obliged to publish these exemptions and modifications on our website. Find out about what exemptions from obligations are in the legislation and how to apply for an exemption or modification. Exemption Instruments made by the AUSTRAC CEO under section 248 of the AML/CTF Act    Business Instrument Name   Crown Entities Exemption 11 of 2021 (PDF, 804KB)   Export Finance Australia Exemption 10 of 2021 (PDF, 219KB)   Good Shepherd Australia New Zealand Exemption 8 of 2021 (PDF, 249KB)   Good Shepherd Microfinance Exemption 7 of 2021 (PDF, 245KB)   Xinja Bank Limited Exemption 5 of 2021 (PDF, 425KB)   Indue Limited Exemption 4 of 2021 (PDF, 651KB)   Mallesons Capital Pty Ltd Exemption 3 of 2021 (PDF, 214 KB)   Xinja Bank Limited Exemption 2 of 2021 (PDF, 476KB)   Westpac Exemption 1 of 2021 (PDF, 162KB)    Commonwealth Bank of Australia  Exemption 17 of 2020 (PDF, 640KB)   Omni Bridgeway Investment Management Limited Exemption 16 of 2020 (PDF, 324KB)   CASL Governance Ltd Exemption 15 of 2020 (PDF, 411KB)   Crown Entities Exemption 14 of 2020 (PDF, 633KB)   CivicRisk Mutual Ltd Exemption 13 of 2020 (PDF, 763KB)   Indigenous Land and Sea Corporation Group Exemption 12 of 2020 (PDF, 552KB)   CBH Grain Pty Ltd Exemption 11 of 2020 (PDF, 581KB)   SG Fleet Group Exemption 10 of 2020 (PDF, 507KB)   Commonwealth Bank of Australia Exemption 9 of 2020 (PDF, 625KB)   Financial Synergy Holdings Exemption 8 of 2020 (PDF, 511KB)   Solium Nominees (Australia) Pty Ltd Exemption 7 of 2020 (PDF, 573KB)   Solium Capital (Australia) Pty Ltd Exemption 6 of 2020 (PDF, 604KB)   Ascender Entities (Ascender Pay Pty Ltd, Ascender Pay ANZ Pty Ltd and Ascender Cloud Services Pty Ltd - formerly, Neller Pty Ltd) Exemption 5 of 2020 (PDF, 92KB)   Glebe Administration Board as trustee for the Diocesan Cash Investment Fund Exemption 4 of 2020 (PDF, 336KB)   HSBC Australia Entities (HSBC Australia Bank Limited; HSBC Custody Nominees (Australia) Limited; The Hong Kong and Shanghai Banking Corporation Limited) Exemption 3 of 2020 (PDF, 346KB)   AMP Life Limited Exemption 2 of 2020 (PDF, 573KB)   Westpac Banking Corporation Exemption 1 of 2020 (PDF, 211KB)   OnePath Group / ANZ Exemption 13 of 2019 (PDF, 145KB)   Westpac Banking Corporation Exemption 12 of 2019 (PDF, 245KB)   Westpac Banking Corporation Exemption 11 of 2019 (PDF, 229KB)   Head Start Homes Ltd Exemption 10 of 2019 (PDF, 144KB)   CCI Asset Management Limited (formerly known as CCI Investment Management Limited) Exemption (Revocation) 9 of 2019 (PDF, 59KB)   Afterpay Pty Ltd Exemption 8 of 2019 (PDF, 216KB)   HSBC Australia Entities (HSBC Bank Australia Limited; HSBC Custody Nominees (Australia) Limited; The Hong Kong and Shanghai Banking Corporation Limited) Exemption 7 of 2019 (PDF, 99KB)   OnePath Life Limited / ANZ Exemption 6 of 2019 (PDF, 133KB)   International Air Transport Association (IATA) Exemption 5 of 2019 (PDF, 103KB)   AAPC Entities (AAPC Management Limited, Accor Australia & New Zealand Hospitality Pty Limited and AAPC Properties Pty Limited) Exemption 4 of 2019 (PDF, 82KB)   Indue Limited Modified Exemption 3 of 2019 (PDF, 128KB)   Precision Administration Services Pty Ltd Exemption 2 of 2019 (PDF, 105KB)   GMF Unit Trust Exemption 1 of 2019 (PDF, 94KB)   Rio Tinto Finance Limited Exemption 8 of 2018 (PDF, 746KB)   Woolworths Group Limited Exemption 7 of 2018 (PDF, 868KB)   Commonwealth Bank of Australia Exemption 5 of 2018 (PDF, 77KB)   Digital currency exchange service providers Exemption 4 of 2018 (PDF, 105KB)   Genriche Pty Ltd Exemption 3 of 2018 (PDF, 86KB)   Computershare Plan Managers Pty Ltd Exemption 2 of 2018 (PDF, 1.2MB)   CPU Share Plans Pty Ltd Exemption 1 of 2018 (PDF, 1.2MB)   Australian Energy Market Operator Limited Exemption 16 of 2017 (PDF, 566KB)   Commonwealth Bank of Australia Exemption 15 of 2017 (PDF, 133KB)   Indue Limited Exemption 14 of 2017) (PDF, 36KB)   CoINVEST Limited Exemption 11 of 2017 (PDF, 393KB)   Commonwealth Bank of Australia Exemption 10 of 2017 (PDF, 73KB)   Capricorn Society Limited Exemption 9 of 2017 (PDF, 532KB)   Cargill Australia Financial Services Pty Ltd Exemption 5 of 2017 (PDF, 545KB)   Cargill Australia Limited Exemption 4 of 2017 (PDF, 571KB)   HSBC Australia Entities (HSBC Bank Australia Limited; HSBC Custody Nominees (Australia) Limited; The Hongkong and Shanghai Banking Corporation Limited) Exemption 1 of 2017 (PDF, 437KB)   Boardroom Financial Services Pty Ltd Exemption 11 of 2016 (PDF, 80KB)   Third Link Investment Managers Pty Ltd Exemption 9 of 2016 (PDF, 42KB)   Telstra Corporation Limited Exemption 8 of 2016 (PDF, 41KB)   Tab Entities (TAB Limited; Tabcorp Holdings Limited; Tabcorp Wagering (Vic) Pty Ltd) Exemption 7 of 2016 (PDF, 102KB)   Reserve Bank of Australia Exemption 6 of 2016 (PDF, 56KB)   Mittopay Pty Ltd Exemption 5 of 2016 (PDF, 50KB)   BHP Coal Pty Ltd Exemption 4 of 2016 (PDF, 217KB)   HCL Australia Service Pty Ltd Exemption 2 of 2016 (PDF, 4KB)   The Foundation for Young Australians Exemption 13 of 2015 (PDF, 181KB)   Automatic Data Processing Limited Exemption 10 of 2015 (PDF, 504KB)   Victorian Funds Management Corporation Exemption 9 of 2015 (PDF, 557KB)   HSBC Australia Entities (HSBC Bank Australia Limited; HSBC Custody Nominees (Australia) Limited; The Hongkong and Shanghai Banking Corporation Limited) Exemption 6 of 2015 (PDF, 1.3MB)   Department of Human Services Exemption 5 of 2015 (PDF, 589KB)   Indue Limited Exemption 4 of 2015 (PDF, 592KB)   Australian Secret Intelligence Service Exemption 3 of 2015 (PDF, 35KB)   BHP Coal Pty Ltd Exemption 2 of 2015 (PDF, 175KB)   Queensland Rural Adjustment Authority Exemption 1 of 2015 (PDF, 474KB)   BMW Financial Services New Zealand Limited Exemption 5 of 2014 (PDF, 72KB)   GSM Mining Company Pty Ltd Exemption 4 of 2014 (PDF, 75KB)   Darlot Mining Company Pty Ltd Exemption 3 of 2014 (PDF, 77KB)   Fairview Equity Partners Pty Ltd Exemption 2 of 2014 (PDF, 1007KB)   Campus Living Accommodation Company Pty Ltd; Campus Living Villages (Macquarie) Pty Ltd; Campus Living Flemington Road Pty Ltd; Campus Living Villages (Parramatta) Pty Ltd; UNSW Village Pty Ltd; Carillon Avenue Pty Ltd) Exemption 1 of 2014 (PDF, 1.5MB)   Rio Tinto Companies (Rio Tinto Limited; Rio Tinto Plc; Queensland Alumina Limited) Exemption 2 of 2013 (PDF, 625KB)   Infigen Energy Entities (Infigen Energy Limited; Infigen Energy Trust; Infigen Energy RE Limited; Infigen Energy (Bermuda) Limited) Exemption 1 of 2013 (PDF, 622KB)   QBE Management Services Pty Ltd Exemption 5 of 2012 (PDF, 519KB)   Chater Hall Escrow Agent Pty Ltd Exemption 4 of 2012 (PDF, 54KB)   The Trust Company (Australia) Limited Exemption 3 of 2012 (PDF, 60KB)   Australia and New Zealand Banking Group Limited Exemption 2 of 2012 (PDF, 736KB)   Playford Capital Pty Ltd Exemption 1 of 2012 (PDF, 446KB)   Remittance Network Providers Exemption 8 of 2011 (PDF, 641KB)   Residential Tenancies Authority of Queensland Exemption 6 of 2011 (PDF, 50KB)   NSW Trustee and Guardian Exemption 5 of 2011 (PDF, 77KB)   Agnew Gold Mining Company Pty Ltd; St Ives Gold Mining Company Pty Ltd Exemptions 1-2 of 2011 (PDF, 1MB)   BHP Billiton Olympic Dam Corporation Pty Ltd Exemption 6 of 2010 (PDF, 56KB)   Department of Treasury and Finance (WA) Exemption 5 of 2010 (PDF, 49KB)   Department of Education Services (WA) Exemption 4 of 2010 (PDF, 52KB)   Indue Limited; Department of Human Services; Commonwealth Service Delivery Agency Exemptions 1-3 of 2010 (PDF, 195KB)   Department of Treasury and Finance (NT) Exemption 24 of 2009 (PDF, 68KB)   South Australian Film Corporation Exemption 23 of 2009 (PDF, 50KB)   La Trobe University Exemption 22 of 2009 (PDF, 47KB)   Australian Power Partners B V & Others; IPower 2 Pty Ltd & IPower Pty Ltd; Canunda Power Pty Ltd; IPM Australia Limited; International Power (Energy) Pty Ltd; Synergen Power Pty Ltd; Pelican Point Power Limited Exemption 21 of 2009 (PDF, 433KB)   Paccar Financial Pty Ltd Exemption 20 of 2009 (PDF, 346KB)   Lifeplan Australia Friendly Society Limited Exemption 19 of 2009 (PDF, 369KB)   State Trustees Limited Exemption 18 of 2009 (PDF, 433KB)   Public Trustee of Western Australia Exemption 17 of 2009 (PDF, 441KB)   Public Trustee of Tasmania Exemption 16 of 2009 (PDF, 427KB)   Public Trustee of South Australia Exemption 15 of 2009 (PDF, 424KB)   Public Trustee of Queensland Exemption 14 of 2009 (PDF, 428KB)   Public Trustee for the Northern Territory Exemption 13 of 2009 (PDF, 431KB)   Public Trustee for the Australian Capital Territory Exemption 12 of 2009 (PDF, 429KB)   Metro Real Estate Services Pty Ltd Exemption 11 of 2009 (PDF, 41KB)   Tullett Prebon (Australia) Pty Ltd Exemption 10 of 2009 (PDF, 53KB)   BHP Billiton Limited; BHP Billiton Plc Exemption 9 of 2009 (PDF, 49KB)   Superannuation Funds Management Corporation of South Australia Exemption 8 of 2009 (PDF, 353KB)   Lifeplan Australia Friendly Society Limited Exemption 7 of 2009 (PDF, 369KB)   BQL Management Pty Ltd Exemption 5 of 2009 (PDF, 352KB)   QSuper (Board of Trustees of the State Public Sector Superannuation Scheme ATF State Public Sector Superannuation Scheme) Exemption 4 of 2009 (PDF, 347KB)   Pacific Custodians Pty Ltd Exemption 3 of 2009 (PDF, 599KB)   ABN AMRO Equity Capital Markets Australia Limited; ABN AMRO Corporate Finance Australia Limited; ABN AMRO Equities Australia Limited Exemption 2 of 2009 (PDF, 1.7MB)   Anglican Managed Investment Fund Diocese of Bathurst Exemption 1 of 2009 (PDF, 343KB)   Public Trustee of Western Australia Exemption 21 of 2008 (PDF, 351KB)   Lifeplan Australia Friendly Society Limited Exemption 20 of 2008 (PDF, 564KB)   Deloitte Management Pty Ltd (ASF Strategic Capital Superannuation Fund) Exemption 19 of 2008 (PDF, 338KB)   Department of Human Services; Commonwealth Service Delivery Agency; ReD Prepaid Cards Australia Pty Ltd Exemption 18 of 2008 (PDF, 668KB)   Citigroup Pty Ltd Exemption 17 of 2008 (PDF, 76KB)   Citigroup Pty Ltd; Bank of Queensland Limited Exemption 16 of 2008 (PDF, 139KB)   Department of Treasury and Finance (Tas) Exemption 15 of 2008 (PDF, 46KB)   Hannover Life Re of Australasia Limited Exemption 14 of 2008 (PDF, 55KB)   Computershare Investor Services Pty Ltd; Computershare Clearing Pty Ltd Exemption 13 of 2008 (PDF, 136KB)   CPU Share Plans Pty Ltd; Computershare Plan Managers Pty Ltd Exemption 12 of 2008 (PDF, 194KB)   CBH Group (Bulkwest Engineering Pty Ltd; Bulkwest Pty Ltd; AgraCorp Pty Ltd; Grain Pool Pty Ltd; Co-operative Bulk Handling Limited) Exemption 11 of 2008 (PDF, 185KB)   Territory Housing; Chief Executive Officer (Housing) Exemption 10 of 2008 (PDF, 85KB)   Absolute Alpha Pty Ltd Exemption 9 of 2008 (PDF, 44KB)   Australian Friendly Society Limited Exemption 8 of 2008 (PDF, 49KB)   Ancient Order of Foresters in Victoria Friendly Society Limited Exemption 7 of 2008 (PDF, 28KB)   Northern Territory Treasury Corporation; Queensland Treasury Corporation; South Australian Government Financing Authority; Tasmanian Public Finance Corporation; Treasury Corporation of Victoria; Western Australian Treasury Corporation; New South Wales Treasury Corporation Exemption 6 of 2008 (PDF, 245KB)   Watson Wyatt Superannuation Pty Ltd (ATF P&O Australia Superannuation Fund) Exemption 5 of 2008) (PDF, 38KB)   Queensland Power Trading Corporation (trading as Enertrade) Exemption 4 of 2008 (PDF, 36KB)   Watson Wyatt Superannuation Pty Ltd (ATF Uncle Tobys Superannuation Fund) Exemption 3 of 2008 (PDF, 38KB)   Pfizer Australia Superannuation Pty Ltd (ATF The Pfizer Australia Superannuation Plan) Exemption 2 of 2008 (PDF, 40KB)   Super Investment Management Pty Ltd Exemption 1 of 2008 (PDF, 35KB)   Combined Life Insurance Company of Australia Limited Exemption 2 of 2007 (PDF, 59KB)   Acorn Prudential Limited Exemption 1 of 2007 (PDF, 1.2MB)     Modification Declarations made by the AUSTRAC CEO under section 248 of the AML/CTF Act     Business/designated service Proposed Instrument Name   Cash Converters Designated Business Group Declaration 2 of 2021 (PDF, 745KB)   PayPal Australia Pty Ltd Declaration 1 of 2021 (PDF, 696KB)   Fintel Alliance Participants Declaration 2 of 2020 (PDF, 219KB)   Archer Capital Pty Ltd Declaration 1 of 2020 (PDF, 477KB)   Equity Trustees Limited Declaration 1 of 2019 (PDF, 123KB)   Tabcorp Designated Business Group and UBET Designated Business Declaration 1 of 2018 (PDF, 72.8KB)   Northern Australia Infrastructure Facility Declaration 2 of 2017 (PDF, 205KB)   Bennelong entities Declaration 1 of 2017 (PDF, 345KB)   Australia and New Zealand Banking Group Limited Declaration 2 of 2016 (PDF, 39KB)   Check Vault Pty Ltd Declaration 4 of 2015 (PDF, 44KB)   Change Global Exchange Pty Ltd Declaration 3 of 2015 (PDF, 374KB)   Jam Payments Pty Ltd Declaration 2 of 2015 (PDF, 469KB)   American Express International Inc Declaration 1 of 2015 (PDF, 3.1MB)   Archer Capital Declaration 4 of 2013 (PDF, 81KB)   Newcastle Permanent Building Society; Newcastle Friendly Society Declaration 3 of 2013 (PDF, 402KB)   Section 75M (Registered persons to advise of material changes in circumstances) Declaration 1 of 2013 (PDF, 194KB)   Westpac Banking Corporation Declaration 3 of 2011 (PDF, 48KB)   Section 45 (Reports of international funds transfer instructions) Declaration 2 of 2010 (PDF, 1.4MB)   Quadrant Private Equity Pty Ltd Declaration 1 of 2010 (PDF, 55KB)   Babcock & Brown International Pty Ltd Declaration 5 of 2009 (PDF, 68KB)   Royal Bank of Scotland plc Declaration 4 of 2009 (PDF, 565KB)   National Australia Bank Limited Declaration 3 of 2009 (PDF, 609KB)   Diners Club Pty Ltd Declaration 2 of 2009 (PDF, 620KB)   Section 38 (Applicable customer identification procedures deemed to be carried out by a reporting entity) Declaration 1 of 2009 (PDF, 48KB)   Babcock & Brown Limited Declaration 4 of 2008 (PDF, 65KB)   Paypal Australia Pty Ltd Declaration 3 of 2008 (PDF, 62KB)   Waratah Housing Co-operative Housing Society Group Declaration 2 of 2008 (PDF, 67KB)   Section 28 (Identification procedures for certain pre-commencement customers); managed investment schemes Declaration 1 of 2008 (PDF, 51KB)    Exemptions made by AUSTRAC under the FTR Act    Business / designated service Instrument Name   Australia Postal Corporation Exemption 12 of 2016 (PDF, 50KB)   Man Investments Australia Limited Exemption 10 of 2016 (PDF, 494KB)   Section 18 (Opening etc of account with a cash dealer); account-blocking obligations Exemption 3 of 2013 (PDF, 20KB)     ",17 May 2021
87,Australia AUSTRAC,Exchange instruments list,,"AUSTRAC shares information and intelligence with AML/CTF financial intelligence units (FIUs) and regulators around the world. We negotiate written agreements (exchange instruments) with each foreign jurisdiction or organisation. These agreements, including memorandums of understanding (MOUs), set out the framework for how we will exchange information with foreign jurisdictions or organisations.    Country Name of FIU Type of exchange instrument     Afghanistan Financial Transactions and Reports Analysis Center of Afghanistan (FinTRACA) MOU   Albania General Directorate for the Prevention of Money Laundering (GDPML) MOU   Anguilla The Money Laundering Reporting Authority (MLRA) MOU   Argentina Unidad de Informacion Financiera (UIF) MOU   Armenia Financial Monitoring Center (FMC) MOU   Bahamas Financial Intelligence Unit Bahamas MOU   Bahrain Bahrain Financial Intelligent Directorate (FID) MOU   Bangladesh Bangladesh Financial Intelligence Unit (BFIU) MOU   Belgium Cellule de Traitement des Informations Financieres - Cel voor Financiele Informatieverwerking (CTIF-CFI) MOU   Bermuda Financial Intelligence Agency Bermuda (FIA) MOU   Brazil Conselha de Controle de Atividades Financeiras / Council for Financial Activities Control (COAF) MOU   British Virgin Islands Financial Investigation Agency of the British Virgin Islands (FIA) MOU   Bulgaria Financial Intelligence Directorate - State Agency for National Security (FID-SANS) MOU   Cambodia Cambodia Financial Intelligence Unit (CAFIU) MOU   Canada Financial Transactions and Reports Analysis Centre of Canada (FINTRAC-CANAFE) MOU/ Regulatory MOU   Cayman Islands Financial Reporting Authority (FRA) MOU   Chile Unidad de Analisis Financiero (UAF) MOU   China China Anti-Money Laundering Monitoring and Analysis Center (CAMLMAC) MOU   China The People’s Bank of China (PBC) MOU/ Regulatory MOU   Colombia Unidad de Informacion y Analisis Financiero (UIAF) MOU   Cook Islands Cook Islands Financial Intelligence Unit (CIFIU) MOU   Croatia Anti-Money Laundering Office - FIU Croatia (AMLO) MOU   Curaçao Intelligence Unit - Curacao (FIU Curacao) MOU   Cyprus Unit for Combating Money Laundering (MOKAS) MOU   Czech Republic Financial Analytical Unit (FAU-CR) MOU   Denmark Money Laundering Secretariat (FIU Denmark) MOU   Ecuador The Financial and Economic Analysis Unit (UAFE) MOU   Egypt Egyptian Money Laundering and Terrorist Financing Combating Unit (ELMCU) MOU   Estonia Rahapesu Andmeburoo / Financial Intelligence Unit - Estonia (MLIB) MOU   Fiji Fiji Financial Intelligence Unit (Fiji-FIU) MOU   Finland Financial Intelligence Unit (RAP) MOU   France Intelligence Processing and Action against Illicit Financial Networks Unit (TRACFIN) MOU   Germany Financial Intelligence Unit Germany MOU   Ghana Financial Intelligence Centre Ghana (FIC) MOU   Gibraltar Gibraltar Financial Intelligence Unit (GCID GFIU) MOU   Greece Hellenic Republic Anti-Money Laundering, Counter-Terrorist Financing and Source of Funds Investigative Authority (Hellenic FIU) MOU   Great Britain Great Britain Gambling Commission Regulatory MOU   Guatemala Intendencia de Verificacion Especial (IVE) MOU   Guernsey Financial Intelligence Service (FIS) MOU   Hong Kong S.A.R China Joint Financial Intelligence Unit (JFIU) MOU   India Financial Intelligence Unit - India (FIU-IND) MOU   Indonesia Pusat Pelaporan Dan Analisis Transaksi Keuangan (PPATK) MOU   Ireland The Money Laundering Investigation Unit of the Garda National Economic Crime Bureau MOU   Israel Israel Money Laundering Prohibition Authority (IMPA) MOU   Italy Financial Intelligence Unit of Italy (UIF) MOU   Jamaica The Financial Investigations Division (FID) MOU   Japan Japan Financial Intelligence Center (JAFIC) Statement of Cooperation   Jersey States of Jersey Police and Customs Joint Financial Crime Unit(FCU) MOU   Jordan Anti Money Laundering and Counter Terrorist Financing Unit (AMLU) MOU   Korea, Republic of Korea Financial Intelligence Unit (KoFIU) MOU   Latvia Office for Prevention of Laundering of Proceeds Derived from Criminal Activities (Control Service) MOU   Lebanon Special Investigations Commission (SIC) MOU   Luxembourg Cellule de Renseignement Financier (CRF) / Financial Intelligence Unit (FIU-LUX) MOU   Macao S.A.R. China Gabinete de Informacao Financiera (GIF) MOU   Macedonia Office for Prevention of Money Laundering and Financing of Terrorism (OPMLFT) Exchange of Letters   Malaysia Bank Negara Malaysia (UPWBNM) MOU   Marshall Islands Domestic Financial Intelligence Unit (DFIU) MOU   Mauritius Financial Intelligence Unit (FIU-Mauritius) MOU   Mexico Unidad de Inteligencia Financiera MOU   Monaco Service d'Information et de Contrôle sur les Circuits Financiers (SICCFIN)​ MOU   Montenegro Administration for the Prevention of Money Laundering and Terrorist Financing (APMLTF) MOU   Netherlands Financial Intelligence Unit - Netherlands (FIU-NL) Letter of Intent   New Zealand New Zealand Police Financial Intelligence Unit (NZ-PFIU) MOU   New Zealand New Zealand Department of Internal Affairs, New Zealand Financial Markets Authority, and Reserve Bank of New Zealand Regulatory MOU   Norway Enheten for Finansiell Etterretning - Financial Intelligence Unit of Norway (EFE) MOU   Pakistan  Financial Monitoring Unit (FMU)  MOU    Panama  Unidad de Analisis Financiero (UAF) MOU    Papua New Guinea  Financial Analysis and Supervision Unit (FASU) MOU   Peru Unidad de Inteligencia Financiera del Peru (UIF - Peru) MOU   Philippines Anti-Money Laundering Council (AMLC) MOU   Poland General Inspector of Financial Information (GIFI) MOU   Portugal Unidade de Informacao Financeira (UIF) MOU   Qatar Qatar Financial Information Unit MOU   Romania Oficiul Nacional de Prevenire se Combatere a Spalarii Banilor / National Office for Prevention and Control of Money Laundering (ONPCSB) MOU   Russia Federalnaja Sluzhba po Finansovomu Monitoringu / Federal Financial Monitoring Service (Rosfinmonitoring) MOU   Saint Kitts and Nevis Financial Intelligence Unit (FIU-SKN) MOU   Saint Vincent and the Grenadines Financial Intelligence Unit St. Vincent and the Grenadines (FIU-SVG) MOU   Saudi Arabia Saudi Arabia Financial Investigation Unit (SAFIU) MOU   Serbia Administration for the Prevention of Money Laundering (APML) MOU   Seychelles Seychelles Financial Intelligence Unit MOU   Singapore Singapore Suspicious Transaction, Reporting Office (STRO) MOU   Slovakia Financial Intelligence Unit of the National Criminal Agency (FSJ) MOU   Slovenia Office for Money Laundering Prevention (OMLP) MOU   South Africa Financial Intelligence Centre (FIC) MOU   Spain El Servicio Ejecutivo de la Comision de Prevencion del Blanqueo de Capitales e Infracciones Monetarias / Executive Service of the Commission for the Prevention of Money Laundering and Monetary Offences (SEPBLAC) MOU   Sri Lanka Financial Intelligence Unit of Sri Lanka (FIU Sri Lanka) MOU   Sweden National Financial Intelligence Service (NFIS) MOU   Thailand The Anti-Money Laundering Office (AMLO) MOU   Trinidad and Tobago Financial Intelligence Unit of Trinidad and Tobago (FIUTT) MOU   Turkey Financial Crimes Investigation Board (MASAK) MOU   Turks & Caicos Islands Financial Intelligence Agency of the Turks and Caicos Islands (FIA) MOU   Ukraine Financial Monitoring Service of Ukraine (SFMS) MOU   United Arab Emirates Anti-Money Laundering and Suspicious Cases Unit MOU   United Kingdom UK Financial Intelligence Unit - National Crime Agency (NCA) MOU   United States of America Financial Crimes Enforcement Network (FinCEN) MOU/ Regulatory MOU   Vanuatu Financial Intelligence Unit (FIU) MOU   Vatican City State Autorita di Informazione Finanziaria / Financial Information Authority (AIF) MOU   Venezuela Superintendencia de Bancos y Otras Instituciones Financieras / National Financial Intelligence Unit (UNIF) MOU     ",21 May 2021
