,Source,Document,URL,Text,Date
858,BIS Working Papers,Monetary policy regimes and macroeconomic outcomes: Hong Kong and Singapore,https://www.bis.org/publ/work204.pdf,,17 April 2006
859,BIS Working Papers,Macro factors in the term structure of credit spreads,https://www.bis.org/publ/work203.pdf,,18 March 2006
860,BIS Working Papers,Time-varying exchange rate pass-through: experiences of some industrial countries,https://www.bis.org/publ/work202.pdf,,17 March 2006
861,BIS Working Papers,"Central banks, governments and the European monetary unification process",https://www.bis.org/publ/work201.pdf,,28 February 2006
862,BIS Working Papers,The future of central bank cooperation,https://www.bis.org/publ/work200.pdf,,27 February 2006
863,BIS Working Papers,Architects of stability? International cooperation among financial supervisors,https://www.bis.org/publ/work199.pdf,,26 February 2006
864,BIS Working Papers,Almost a century of central bank cooperation,https://www.bis.org/publ/work198.pdf,,25 February 2006
865,BIS Working Papers,One hundred and thirty years of central bank cooperation: a BIS perspective,https://www.bis.org/publ/work197.pdf,,24 February 2006
866,BIS Working Papers,The evolving inflation process: an overview,https://www.bis.org/publ/work196.pdf,,23 February 2006
867,BIS Working Papers,Interpreting Euro area inflation at high and low frequencies,https://www.bis.org/publ/work195.pdf,,22 February 2006
868,BIS Working Papers,Output gaps and inflation in Mainland China,https://www.bis.org/publ/work194.pdf,,21 February 2006
869,BIS Working Papers,Procyclicality in the financial system: do we need a new macrofinancial stabilisation framework?,https://www.bis.org/publ/work193.pdf,,06 January 2006
870,BIS Working Papers,The mechanics of devaluations and the output response in a DSGE model: how relevant is the balance sheet effect?,https://www.bis.org/publ/work192.pdf,,30 November 2005
871,BIS Working Papers,Explaining the level of credit spreads: option-implied jump risk premia in a  firm value model,https://www.bis.org/publ/work191.pdf,,23 November 2005
872,BIS Working Papers,The pricing of unexpected credit losses,https://www.bis.org/publ/work190.pdf,,22 November 2005
873,BIS Working Papers,Beyond current policy frameworks,https://www.bis.org/publ/work189.pdf,,21 November 2005
874,BIS Working Papers,"Japan's deflation, problems in the financial system and monetary policy",https://www.bis.org/publ/work188.pdf,,20 November 2005
875,BIS Working Papers,"External shocks, transmission mechanisms and deflation in Asia",https://www.bis.org/publ/work187.pdf,,19 November 2005
876,BIS Working Papers,Deflation in a historical perspective,https://www.bis.org/publ/work186.pdf,,18 November 2005
877,BIS Working Papers,Has the inflation process changed?,https://www.bis.org/publ/work185.pdf,,17 November 2005
878,BIS Working Papers,A nonparametric analysis of the shape dynamics of the US personal income distribution: 1962-2000,https://www.bis.org/publ/work184.pdf,,02 October 2005
879,BIS Working Papers,The fragility of the Phillips curve: A bumpy ride in the frequency domain,https://www.bis.org/publ/work183.pdf,,01 October 2005
880,BIS Working Papers,Revisiting recent productivity developments across OECD countries,https://www.bis.org/publ/work182.pdf,,28 September 2005
881,BIS Working Papers,Explaining credit default swap spreads with equity volatility and jump risks of  individual firms ,https://www.bis.org/publ/work181.pdf,,02 September 2005
882,BIS Working Papers,"Accounting, prudential regulation and financial stability: elements of a  synthesis  ",https://www.bis.org/publ/work180.pdf,,01 September 2005
883,BIS Working Papers,An empirical evaluation of structural credit risk models,https://www.bis.org/publ/work179.pdf,,01 July 2005
884,BIS Working Papers,Research on exchange rates and monetary policy: an overview,https://www.bis.org/publ/work178.pdf,,01 June 2005
885,BIS Working Papers,Forbearance and prompt corrective action,https://www.bis.org/publ/work177.pdf,,01 May 2005
886,BIS Working Papers,Debt-deflation: concepts and a stylised model,https://www.bis.org/publ/work176.pdf,,03 April 2005
887,BIS Working Papers,Commercial property prices and bank performance ,https://www.bis.org/publ/work175.pdf,,02 April 2005
888,BIS Working Papers,How does fiscal policy affect monetary policy in emerging market countries? ,https://www.bis.org/publ/work174.pdf,,01 April 2005
889,BIS Working Papers,Measuring default risk premia from default swap rates and EDFs ,https://www.bis.org/publ/work173.pdf,,03 March 2005
890,BIS Working Papers,The effectiveness of foreign exchange intervention in emerging market countries: evidence from the Czech koruna ,https://www.bis.org/publ/work172.pdf,,02 March 2005
891,BIS Working Papers,The role of the natural rate of interest in monetary policy ,https://www.bis.org/publ/work171.pdf,,01 March 2005
892,BIS Working Papers,A model of the IMF as a coinsurance arrangement ,https://www.bis.org/publ/work170.pdf,,02 February 2005
893,BIS Working Papers,Current account adjustment and capital flows ,https://www.bis.org/publ/work169.pdf,,01 February 2005
894,BIS Working Papers,"Inflation targeting, asset prices and financial imbalances: conceptualizing the debate ",https://www.bis.org/publ/work168.pdf,,04 January 2005
895,BIS Working Papers,Asset prices and banking distress: a macroeconomic approach ,https://www.bis.org/publ/work167.pdf,,03 December 2004
896,BIS Working Papers,Are speculative attacks triggered by sunspots? A new test,https://www.bis.org/publ/work166.pdf,,02 December 2004
897,BIS Working Papers,Stress-testing financial systems: an overview of current methodologies ,https://www.bis.org/publ/work165.pdf,,01 December 2004
898,BIS Working Papers,Did investors regard real estate as 'safe' during the 'Japanese Bubble' in the 1980s? ,https://www.bis.org/publ/work164.pdf,,02 November 2004
899,BIS Working Papers,CDO rating methodology: Some thoughts on model risk and its implications ,https://www.bis.org/publ/work163.pdf,,01 November 2004
900,BIS Working Papers,Recent fiscal policy in selected industrial countries ,https://www.bis.org/publ/work162.pdf,,02 September 2004
901,BIS Working Papers,The monetisation of Japan's government debt ,https://www.bis.org/publ/work161.pdf,,01 September 2004
902,BIS Working Papers,An empirical comparison of credit spreads between the bond market and the credit default swap market ,https://www.bis.org/publ/work160.pdf,,02 August 2004
903,BIS Working Papers,The term structure of credit spreads in project finance ,https://www.bis.org/publ/work159.pdf,,01 August 2004
904,BIS Working Papers,Market distress and vanishing liquidity: anatomy and policy options ,https://www.bis.org/publ/work158.pdf,,04 July 2004
905,BIS Working Papers,Securing sustainable price stability: should credit come back from the wilderness? ,https://www.bis.org/publ/work157.pdf,,02 July 2004
906,BIS Working Papers,Deposit Insurance and Bank Intermediation in the Long Run ,https://www.bis.org/publ/work156.pdf,,01 July 2004
907,BIS Working Papers,Monetary policy and asset price bubbles: calibrating the monetary policy trade-offs ,https://www.bis.org/publ/work155.pdf,,03 June 2004
908,BIS Working Papers,"Monetary and real shocks, the business cycle and the value of the euro ",https://www.bis.org/publ/work154.pdf,,02 June 2004
909,BIS Working Papers,Macroeconomic implications of rising household debt ,https://www.bis.org/publ/work153.pdf,,01 June 2004
910,BIS Working Papers,Back to the future? Assessing the deflation record ,https://www.bis.org/publ/work152.pdf,,05 March 2004
911,BIS Working Papers,Bank ties and bond market access: evidence on investment-cash flow sensitivity in Japan ,https://www.bis.org/publ/work151.pdf,,04 March 2004
912,BIS Working Papers,Bank lending and commercial property cycles: some cross-country evidence ,https://www.bis.org/publ/work150.pdf,,03 March 2004
913,BIS Working Papers,Monetary policy rules in emerging market economies: issues and evidence ,https://www.bis.org/publ/work149.pdf,,02 March 2004
914,BIS Working Papers,The 2001 US recession: what did recession prediction models tell us? ,https://www.bis.org/publ/work148.pdf,,01 March 2004
915,BIS Working Papers,Whither monetary and financial stability? the implications of evolving policy regimes ,https://www.bis.org/publ/work147.pdf,,01 February 2004
916,BIS Working Papers,Consumer credit scoring: do situational circumstances matter? ,https://www.bis.org/publ/work146.pdf,,05 January 2004
917,BIS Working Papers,Are changes in financial structure extending safety nets? ,https://www.bis.org/publ/work145.pdf,,04 January 2004
918,BIS Working Papers,Transparency versus constructive ambiguity in foreign exchange intervention ,https://www.bis.org/publ/work144.pdf,,03 October 2003
919,BIS Working Papers,The Balassa-Samuelson effect in central Europe: a disaggregated analysis ,https://www.bis.org/publ/work143.pdf,,02 October 2003
920,BIS Working Papers,Three episodes of financial fragility in Norway since the 1890s ,https://www.bis.org/publ/work142.pdf,,01 October 2003
921,BIS Working Papers,Financial strains and the zero lower bound: the Japanese experience ,https://www.bis.org/publ/work141.pdf,,09 September 2003
922,BIS Working Papers,"Asset prices, financial imbalances and monetary policy: are inflation targets enough? ",https://www.bis.org/publ/work140.pdf,,08 September 2003
923,BIS Working Papers,External constraints on monetary policy and the financial accelerator ,https://www.bis.org/publ/work139.pdf,,07 September 2003
924,BIS Working Papers,Public and private information in monetary policy models,https://www.bis.org/publ/work138.pdf,,06 September 2003
925,BIS Working Papers,The Great Depression as a credit boom gone wrong ,https://www.bis.org/publ/work137.pdf,,05 September 2003
926,BIS Working Papers,"The price level, relative prices and economic stability: aspects of the interwar debate ",https://www.bis.org/publ/work136.pdf,,04 September 2003
927,BIS Working Papers,Currency Crises and the Informational Role of Interest Rates ,https://www.bis.org/publ/work135.pdf,,03 September 2003
928,BIS Working Papers,The cost of barriers to entry: evidence from the market for corporate euro bond underwriting ,https://www.bis.org/publ/work134.pdf,,02 September 2003
929,BIS Working Papers,How good is the BankScope database? A cross-validation exercise with correction factors for market concentration measures ,https://www.bis.org/publ/work133.pdf,,01 September 2003
930,BIS Working Papers,Developing country economic structure and the pricing of syndicated credits ,https://www.bis.org/publ/work132.pdf,,01 July 2003
931,BIS Working Papers,Optimal supervisory policies and depositor-preference laws ,https://www.bis.org/publ/work131.pdf,,01 March 2003
932,BIS Working Papers,Living with flexible exchange rates: issues and recent experience in inflation targeting emerging market economies,https://www.bis.org/publ/work130.pdf,,05 February 2003
933,BIS Working Papers,Are credit ratings procyclical? ,https://www.bis.org/publ/work129.pdf,,03 February 2003
934,BIS Working Papers,Towards a macroprudential framework for financial supervision and regulation? ,https://www.bis.org/publ/work128.pdf,,02 February 2003
935,BIS Working Papers,A tale of two perspectives: old or new challenges for monetary policy? ,https://www.bis.org/publ/work127.pdf,,01 February 2003
936,BIS Working Papers,A survey of cyclical effects in credit risk measurement model,https://www.bis.org/publ/work126.pdf,,09 January 2003
937,BIS Working Papers,The institutional memory hypothesis and the procyclicality of bank lending behaviour ,https://www.bis.org/publ/work125.pdf,,07 January 2003
938,BIS Working Papers,"Credit constraints, financial liberalisation and twin crises ",https://www.bis.org/publ/work124.pdf,,06 January 2003
939,BIS Working Papers,Communication and monetary policy ,https://www.bis.org/publ/work123.pdf,,05 January 2003
940,BIS Working Papers,Positive feedback trading under stress: Evidence from the US Treasury securities market ,https://www.bis.org/publ/work122.pdf,,04 January 2003
941,BIS Working Papers,Implications of habit formation for optimal monetary policy ,https://www.bis.org/publ/work121.pdf,,02 November 2002
942,BIS Working Papers,Changes in market functioning and central bank policy: an overview of the issues ,https://www.bis.org/publ/work120.pdf,,01 October 2002
943,BIS Working Papers,A VAR analysis of the effects of monetary policy in East Asia,https://www.bis.org/publ/work119.pdf,,04 September 2002
944,BIS Working Papers,Should banks be diversified? Evidence from individual bank loan portfolios,https://www.bis.org/publ/work118.pdf,,03 September 2002
945,BIS Working Papers,"Internal ratings, the business cycle and capital requirements: some evidence from an emerging market economy",https://www.bis.org/publ/work117.pdf,,02 September 2002
946,BIS Working Papers,Credit risk measurement and procyclicality,https://www.bis.org/publ/work116.pdf,,01 September 2002
947,BIS Working Papers,China's asset management corporations,https://www.bis.org/publ/work115.pdf,,01 August 2002
948,BIS Working Papers,"Asset prices, financial and monetary stability: exploring the nexus ",https://www.bis.org/publ/work114.pdf,,02 July 2002
949,BIS Working Papers,The link between default and recovery rates: effects on the procyclicality of regulatory capital ratios ,https://www.bis.org/publ/work113.pdf,,01 July 2002
950,BIS Working Papers,Determinants of international bank lending to emerging market countries ,https://www.bis.org/publ/work112.pdf,,01 June 2002
951,BIS Working Papers,Output trends and Okun's law ,https://www.bis.org/publ/work111.pdf,,01 April 2002
952,BIS Working Papers,A survey of the institutional and operational aspects of modern-day currency boards ,https://www.bis.org/publ/work110.pdf,,01 March 2002
953,BIS Working Papers,Optimal dynamic hedging using futures under a borrowing constraint ,https://www.bis.org/publ/work109.pdf,,04 January 2002
954,BIS Working Papers,The determinants of private sector credit in industrialised countries: do property prices matter? ,https://www.bis.org/publ/work108.pdf,,04 December 2001
955,BIS Working Papers,"Bank runs, welfare and policy implications ",https://www.bis.org/publ/work107.pdf,,03 December 2001
956,BIS Working Papers,Bank runs without self-fulfilling prophecies,https://www.bis.org/publ/work106.pdf,,02 December 2001
957,BIS Working Papers,Macroeconomic news and the euro/dollar exchange rate ,https://www.bis.org/publ/work105.pdf,,01 December 2001
958,BIS Working Papers,The changing shape of fixed income markets ,https://www.bis.org/publ/work104.pdf,,01 September 2001
959,BIS Working Papers,The costs and benefits of moral suasion: Evidence from the rescue of long-term capital management ,https://www.bis.org/publ/work103.pdf,,02 August 2001
960,BIS Working Papers,"Allocating bank regulatory powers: lender of last resort, deposit insurance and supervision ",https://www.bis.org/publ/work102.pdf,,01 August 2001
961,BIS Working Papers,Can liquidity risk be subsumed in credit risk? A case study from Brady bond prices ,https://www.bis.org/publ/work101.pdf,,02 July 2001
962,BIS Working Papers,The impact of the euro on Europe's financial markets ,https://www.bis.org/publ/work100.pdf,,01 July 2001
963,BIS Working Papers,The interbank market during a crisis ,https://www.bis.org/publ/work99.pdf,,01 June 2001
964,BIS Working Papers,Money and inflation in the Euro Area: A case for monetary indicators? ,https://www.bis.org/publ/work98.pdf,,04 January 2001
965,BIS Working Papers,Information flows during the asian crisis: evidence from closed-end funds ,https://www.bis.org/publ/work97.pdf,,02 December 2000
966,BIS Working Papers,The real-time predictive content of money for output ,https://www.bis.org/publ/work96.pdf,,01 December 2000
967,BIS Working Papers,The impact of corporate risk management on monetary policy transmission: some empirical evidence ,https://www.bis.org/publ/work95.pdf,,02 November 2000
968,BIS Working Papers,Corporate hedging: the impact of financial derivatives on the broad credit channel of monetary policy ,https://www.bis.org/publ/work94.pdf,,01 November 2000
969,BIS Working Papers,"Trading volumes, volatility and spreads in foreign exchange markets: evidence from emerging market countries ",https://www.bis.org/publ/work93.pdf,,03 October 2000
970,BIS Working Papers,Recent initiatives to improve the regulation and supervision of private capital flows ,https://www.bis.org/publ/work92.pdf,,02 October 2000
971,BIS Working Papers,Measuring potential vulnerabilities in emerging market economies ,https://www.bis.org/publ/work91.pdf,,01 October 2000
972,BIS Working Papers,Bank capital regulation in contemporary banking theory: a review of the literature ,https://www.bis.org/publ/work90.pdf,,01 September 2000
973,BIS Working Papers,Forecast-based monetary policy ,https://www.bis.org/publ/work89.pdf,,01 August 2000
974,BIS Working Papers,Evidence on the response of US banks to changes in capital requirements ,https://www.bis.org/publ/work88.pdf,,01 June 2000
975,BIS Working Papers,Monetary policy in an estimated optimisation-based model with sticky prices and wages ,https://www.bis.org/publ/work87.pdf,,01 May 2000
976,BIS Working Papers,"Information, liquidity and risk in the international interbank market: implicit guarantees and private credit market failure ",https://www.bis.org/publ/work86.pdf,,01 March 2000
977,BIS Working Papers,A defence of the expectations theory as a model of us long-term interest rates ,https://www.bis.org/publ/work85.pdf,,03 January 2000
978,BIS Working Papers,What have we learned from recent financial crises and policy responses? ,https://www.bis.org/publ/work84.pdf,,02 January 2000
979,BIS Working Papers,Switching from single to multiple bank lending relationships: determinants and implications ,https://www.bis.org/publ/work83.pdf,,01 January 2000
980,BIS Working Papers,Sacrifice ratios and the conduct of monetary policy in conditions of low inflation ,https://www.bis.org/publ/work82.pdf,,04 November 1999
981,BIS Working Papers,Interbank interest rates and the risk premium ,https://www.bis.org/publ/work81.pdf,,03 November 1999
982,BIS Working Papers,A note on alternative measures of real bond rates ,https://www.bis.org/publ/work80.pdf,,02 November 1999
983,BIS Working Papers,Pass-through of exchange rates and import prices to domestic inflation in some industrialised economies ,https://www.bis.org/publ/work79.pdf,,01 November 1999
984,BIS Working Papers,Banking and commerce: a liquidity approach ,https://www.bis.org/publ/work78.pdf,,03 October 1999
985,BIS Working Papers,"Perceived central bank intervention and market expectations: an empirical study of the yen/dollar exchange rate, 1993 - 96",https://www.bis.org/publ/work77.pdf,,02 October 1999
986,BIS Working Papers,The price of risk at year-end: evidence from interbank lending ,https://www.bis.org/publ/work76.pdf,,01 October 1999
987,BIS Working Papers,A note on the Gordon growth model with nonstationary dividend growth ,https://www.bis.org/publ/work75.pdf,,04 August 1999
988,BIS Working Papers,The Dollar - Mark axis ,https://www.bis.org/publ/work74.pdf,,03 August 1999
989,BIS Working Papers,The Taylor rule and interest rates in the EMU area: a note ,https://www.bis.org/publ/work73.pdf,,02 August 1999
990,BIS Working Papers,Reserve currency allocation: an alternative methodology ,https://www.bis.org/publ/work72.pdf,,01 August 1999
991,BIS Working Papers,The term structure of announcement effects ,https://www.bis.org/publ/work71.pdf,,03 June 1999
992,BIS Working Papers,Interbank exposures: quantifying the risk of contagion ,https://www.bis.org/publ/work70.pdf,,02 June 1999
993,BIS Working Papers,Credit channels and consumption in Europe: empirical evidence ,https://www.bis.org/publ/work69.pdf,,01 June 1999
994,BIS Working Papers,The evolution and determinants of emerging markets credit spreads in the 1990s ,https://www.bis.org/publ/work68.pdf,,02 May 1999
995,BIS Working Papers,The cyclical sensitivity of seasonality in US employment ,https://www.bis.org/publ/work67.pdf,,01 May 1999
996,BIS Working Papers,Evolving international financial markets: some implications for Central Banks ,https://www.bis.org/publ/work66.pdf,,02 April 1999
997,BIS Working Papers,Higher profits and lower capital prices: is factor allocation optimal? ,https://www.bis.org/publ/work65.pdf,,01 April 1999
998,BIS Working Papers,Precarious credit equilibria: reflections on the Asian financial crisis ,https://www.bis.org/publ/work64.pdf,,03 March 1999
999,BIS Working Papers,Microeconomic inventory adjustment and aggregate dynamics ,https://www.bis.org/publ/work63.pdf,,02 March 1999
1000,BIS Working Papers,The pricing of bank lending and borrowing: evidence from the federal funds market,https://www.bis.org/publ/work62.pdf,,01 March 1999
1001,BIS Working Papers,Foreign direct investment and employment in the industrial countries,https://www.bis.org/publ/work61.pdf,,04 November 1998
1002,BIS Working Papers,Output gap uncertainty: does it matter for the Taylor rule? ,https://www.bis.org/publ/work60.pdf,,03 November 1998
1003,BIS Working Papers,Portfolio selection using fuzzy decision theory ,https://www.bis.org/publ/work59.pdf,,02 November 1998
1004,BIS Working Papers,The importance of bank seniority for relationship lending ,https://www.bis.org/publ/work58.pdf,,01 November 1998
1005,BIS Working Papers,One-step prediction of financial time series ,https://www.bis.org/publ/work57.pdf,,01 July 1998
1006,BIS Working Papers,Commercial banks in the securities business: A review ,https://www.bis.org/publ/work56.pdf,,03 June 1998
1007,BIS Working Papers,Spread overreaction in international bond markets ,https://www.bis.org/publ/work55.pdf,,02 June 1998
1008,BIS Working Papers,The coming transformation of continental european banking? ,https://www.bis.org/publ/work54.pdf,,01 June 1998
1009,BIS Working Papers,Exchange rate regimes and inflation and output in Sub-Saharan countries ,https://www.bis.org/publ/work53.pdf,,01 March 1998
1010,BIS Working Papers,Inflation and disinflation in Iceland,https://www.bis.org/publ/work52.pdf,,04 January 1998
1011,BIS Working Papers,Forecast errors and financial developments,https://www.bis.org/publ/work51.pdf,,02 November 1997
1012,BIS Working Papers,The euro and the dollar,https://www.bis.org/publ/work50.pdf,,01 November 1997
1013,BIS Working Papers,Why does the yield curve predict economic activity? Dissecting the evidence for Germany and the United States,https://www.bis.org/publ/work49.pdf,,04 September 1997
1014,BIS Working Papers,Some multi-country evidence on the effects of real exchange rates on output,https://www.bis.org/publ/work48.pdf,,03 September 1997
1015,BIS Working Papers,Financial asset prices and monetary policy: theory and evidence,https://www.bis.org/publ/work47.pdf,,02 September 1997
1016,BIS Working Papers,Global asset allocation in fixed income markets,https://www.bis.org/publ/work46.pdf,,01 September 1997
1017,BIS Working Papers,A multi-country comparison of the linkages between inflation and exchange rate competitiveness,https://www.bis.org/publ/work45.pdf,,01 August 1997
1018,BIS Working Papers,Is there excess comovement of bond yields between countries?,https://www.bis.org/publ/work44.pdf,,03 July 1997
1019,BIS Working Papers,Exchange rate regimes and the expectations hypothesis of the term structure,https://www.bis.org/publ/work43.pdf,,02 July 1997
1020,BIS Working Papers,"Measuring monetary policy shocks in France, Germany and Italy: The role of the exchange rate",https://www.bis.org/publ/work42.pdf,,01 June 1997
1021,BIS Working Papers,The Euro and European financial markets,https://www.bis.org/publ/work41.pdf,,01 May 1997
1022,BIS Working Papers,Monetary policy operating procedures in industrial countries,https://www.bis.org/publ/work40.pdf,,01 March 1997
1023,BIS Working Papers,Banking system failures in developing and transition countries: Diagnosis and predictions,https://www.bis.org/publ/work39.pdf,,04 January 1997
1024,BIS Working Papers,International agreements in the area of banking and finance: accomplishments and outstanding issues ,https://www.bis.org/publ/work38.pdf,,01 October 1996
1025,BIS Working Papers,Does the term structure predict recessions? The international evidence ,https://www.bis.org/publ/work37.pdf,,01 September 1996
1026,BIS Working Papers,Estimation of speculative attack models: Mexico yet again ,https://www.bis.org/publ/work36.pdf,,01 August 1996
1027,BIS Working Papers,Varieties of monetary operating procedures: balancing monetary objectives with market efficiency ,https://www.bis.org/publ/work35.pdf,,01 July 1996
1028,BIS Working Papers,Monetary policy and the behaviour of interest rates: are long rates excessively volatile?,https://www.bis.org/publ/work34.pdf,,24 January 1996
1029,BIS Working Papers,Derivatives and asset price volatility: a test using variance ratios,https://www.bis.org/publ/work33.pdf,,21 January 1996
1030,BIS Working Papers,The anatomy of the bond market turbulence of 1994,https://www.bis.org/publ/work32.pdf,,22 December 1995
1031,BIS Working Papers,Testing the quantity theory using long-run averaged cross-country data,https://www.bis.org/publ/work31.pdf,,21 December 1995
1032,BIS Working Papers,Money demand stability and currency substitution in six European countries (1980-1992),https://www.bis.org/publ/work30.pdf,,21 November 1995
1033,BIS Working Papers,The information content of the term structure: evidence for Germany,https://www.bis.org/publ/work29.pdf,,21 September 1995
1034,BIS Working Papers,The term structure of Euro-rates: some evidence in support of the expectations hypothesis,https://www.bis.org/publ/work28.pdf,,21 August 1995
